{
  "schema": "reovim-workspace-topology/v2",
  "limits": {
    "configuration": {
      "config_bytes": 1048576,
      "json_depth": 128,
      "json_container_items": 200000,
      "report_bytes": 67108864,
      "findings": 8192
    },
    "inventory": {
      "source_entry_count": 16384,
      "directory_entry_count": 8192,
      "source_file_count": 8192,
      "source_total_bytes": 67108864,
      "source_file_bytes": 4194304,
      "path_bytes": 4096,
      "syntax_item_expr_type_visits": 1000000
    },
    "process": {
      "stdout_bytes": 16777216,
      "stderr_bytes": 1048576,
      "execution_deadline_ms": 120000,
      "supervision_deadline_ms": 130000,
      "tool_executable_bytes": 100663296
    },
    "product_execution": {
      "scratch_bytes": 536870912,
      "scratch_inodes": 32768,
      "process_address_space_bytes": 4294967296,
      "process_cpu_seconds": 120,
      "process_open_files": 256,
      "process_output_file_bytes": 268435456,
      "core_dump_bytes": 0,
      "exposure_entry_count": 8192,
      "compiler_substrate_entry_count": 8192,
      "compiler_substrate_total_bytes": 1073741824,
      "cargo_json_bytes": 16777216,
      "cargo_message_count": 4096,
      "wrapper_trace_bytes": 16777216,
      "wrapper_argv_items": 4096,
      "wrapper_argv_bytes": 1048576,
      "compiler_unit_count": 256,
      "compiler_input_count": 8192,
      "dep_info_file_bytes": 4194304,
      "dep_info_total_bytes": 67108864,
      "artifact_count": 4096,
      "artifact_total_bytes": 536870912,
      "package_list_bytes": 4194304,
      "package_member_count": 8192,
      "public_item_count": 4096,
      "environment_dependency_count": 1024
    }
  },
  "repository_entrypoints": [
    {
      "kind": "script",
      "path": "scripts/check.sh",
      "content_digest": "sha256:10cba8a2ef7cee4aa2cf2848bfd99a28a895e5de11f5bd855863d834d633692d"
    },
    {
      "kind": "script",
      "path": "scripts/check-cache.sh",
      "content_digest": "sha256:6654edd59c5bd3427365a8e0f38f09f4d277f84d45127f6b6db1c6c50b5b06ea"
    },
    {
      "kind": "script",
      "path": "scripts/check-style.sh",
      "content_digest": "sha256:bde996effe1761bd1cf663774bb99efb14da235f33f07c5eb859f9d72d174c16"
    },
    {
      "kind": "script",
      "path": "scripts/check-documentation.sh",
      "content_digest": "sha256:cf70d632405595ee2f4161c151deecb70188a041a8ae3ac544f4c931b96602d6"
    },
    {
      "kind": "script",
      "path": "scripts/check-conformance.sh",
      "content_digest": "sha256:60dc938f3887f0c81b23e5b5b6811069bf8df90725464879f9f3c39e7b2294cf"
    },
    {
      "kind": "workflow",
      "path": ".github/workflows/ci.yml",
      "content_digest": "sha256:b3f71d42639c90dbf5cb063e19ece01518ed51f8ce1f20b223d845cd36c772d6"
    },
    {
      "kind": "cargo_target",
      "package": "reovim-conformance",
      "target": "reovim-conformance"
    }
  ],
  "workspaces": [
    {
      "id": "repository-tooling",
      "partition": "repository_tooling",
      "root": ".",
      "workspace_manifest": "Cargo.toml",
      "lockfile": "Cargo.lock",
      "members": [
        "lib/depgraph",
        "tools/conformance"
      ],
      "cargo_config_files": [],
      "build_scripts": [],
      "custom_target_specs": [],
      "linker_assets": [],
      "metadata_profiles": [
        {
          "id": "hosted-default",
          "target_triple": "x86_64-unknown-linux-gnu",
          "all_features": false,
          "no_default_features": false,
          "features": []
        },
        {
          "id": "hosted-all-features",
          "target_triple": "x86_64-unknown-linux-gnu",
          "all_features": true,
          "no_default_features": false,
          "features": []
        },
        {
          "id": "hosted-no-default-features",
          "target_triple": "x86_64-unknown-linux-gnu",
          "all_features": false,
          "no_default_features": true,
          "features": []
        }
      ],
      "packages": [
        {
          "id": "reovim-depgraph",
          "name": "reovim-depgraph",
          "version": "0.16.0-dev",
          "manifest": "lib/depgraph/Cargo.toml",
          "targets": [
            {
              "id": "library",
              "name": "reovim_depgraph",
              "kind": ["lib"],
              "crate_types": ["lib"],
              "src_path": "lib/depgraph/src/lib.rs"
            },
            {
              "id": "integration-test",
              "name": "depgraph",
              "kind": ["test"],
              "crate_types": ["bin"],
              "src_path": "lib/depgraph/src/tests.rs"
            }
          ]
        },
        {
          "id": "reovim-conformance",
          "name": "reovim-conformance",
          "version": "0.16.0-dev",
          "manifest": "tools/conformance/Cargo.toml",
          "targets": [
            {
              "id": "library",
              "name": "reovim_conformance",
              "kind": ["lib"],
              "crate_types": ["lib"],
              "src_path": "tools/conformance/src/lib.rs"
            },
            {
              "id": "command",
              "name": "reovim-conformance",
              "kind": ["bin"],
              "crate_types": ["bin"],
              "src_path": "tools/conformance/src/main.rs"
            },
            {
              "id": "integration-test",
              "name": "checker",
              "kind": ["test"],
              "crate_types": ["bin"],
              "src_path": "tools/conformance/tests/checker.rs"
            }
          ]
        }
      ]
    },
    {
      "id": "product",
      "partition": "product",
      "root": "product",
      "workspace_manifest": "product/Cargo.toml",
      "lockfile": "product/Cargo.lock",
      "members": [
        "kernel/foundation",
        "kernel/interface",
        "tests/foundation-public-consumer",
        "tests/kernel-interface-public-consumer"
      ],
      "cargo_config_files": [],
      "build_scripts": [],
      "custom_target_specs": [],
      "linker_assets": [],
      "metadata_profiles": [
        {
          "id": "release",
          "target_triple": "x86_64-unknown-linux-gnu",
          "all_features": false,
          "no_default_features": false,
          "features": []
        }
      ],
      "packages": [
        {
          "id": "foundation",
          "name": "reovim-foundation",
          "version": "0.16.0-dev",
          "manifest": "kernel/foundation/Cargo.toml",
          "targets": [
            {
              "id": "library",
              "name": "reovim_foundation",
              "kind": ["lib"],
              "crate_types": ["lib"],
              "src_path": "kernel/foundation/src/lib.rs"
            }
          ]
        },
        {
          "id": "foundation-public-consumer",
          "name": "reovim-foundation-public-consumer",
          "version": "0.16.0-dev",
          "manifest": "tests/foundation-public-consumer/Cargo.toml",
          "targets": [
            {
              "id": "library",
              "name": "reovim_foundation_public_consumer",
              "kind": ["lib"],
              "crate_types": ["lib"],
              "src_path": "tests/foundation-public-consumer/src/lib.rs"
            }
          ]
        },
        {
          "id": "kernel-interface",
          "name": "reovim-kernel-interface",
          "version": "0.16.0-dev",
          "manifest": "kernel/interface/Cargo.toml",
          "targets": [
            {
              "id": "library",
              "name": "reovim_kernel_interface",
              "kind": ["lib"],
              "crate_types": ["lib"],
              "src_path": "kernel/interface/src/lib.rs"
            }
          ]
        },
        {
          "id": "kernel-interface-public-consumer",
          "name": "reovim-kernel-interface-public-consumer",
          "version": "0.16.0-dev",
          "manifest": "tests/kernel-interface-public-consumer/Cargo.toml",
          "targets": [
            {
              "id": "library",
              "name": "reovim_kernel_interface_public_consumer",
              "kind": ["lib"],
              "crate_types": ["lib"],
              "src_path": "tests/kernel-interface-public-consumer/src/lib.rs"
            },
            {
              "id": "integration-test",
              "name": "kernel-interface-public-contract",
              "kind": ["test"],
              "crate_types": ["bin"],
              "src_path": "tests/kernel-interface-public-consumer/tests/public_contract.rs"
            }
          ]
        }
      ]
    }
  ]
}
